{
  "$schema": "extraction_spec_v1",
  "source": {
    "file": "player_controller.gd",
    "class": "PlayerController"
  },
  "state_fields": [
    { "id": "state", "field": "current_state", "type": "enum", "pattern": "enum State", "initial": "IDLE" }
  ],
  "methods": [
    { "id": "move", "name": "_on_move", "controllable": false, "note": "Player input" },
    { "id": "jump", "name": "_on_jump", "controllable": false, "note": "Player input" },
    { "id": "attack", "name": "_on_attack", "controllable": false, "note": "Player input" },
    { "id": "die", "name": "_on_die", "controllable": false, "note": "Damage from environment" }
  ],
  "model_config": {
    "context_name": "PlayerFSM",
    "uncontrollable_labels": ["ev_move", "ev_stop_move", "ev_jump", "ev_attack", "ev_fall", "ev_land", "ev_attack_end", "ev_die"],
    "controllable_labels": ["ev_respawn"],
    "automata": [
      {
        "id": "PlayerState",
        "states": [
          { "name": "Idle", "initial": true },
          { "name": "Running" },
          { "name": "Jumping" },
          { "name": "Falling" },
          { "name": "Attacking" },
          { "name": "Dead" }
        ],
        "transitions": [
          { "from": "Idle", "to": "Running", "label": "ev_move" },
          { "from": "Idle", "to": "Jumping", "label": "ev_jump" },
          { "from": "Idle", "to": "Attacking", "label": "ev_attack" },
          { "from": "Running", "to": "Idle", "label": "ev_stop_move" },
          { "from": "Running", "to": "Jumping", "label": "ev_jump" },
          { "from": "Jumping", "to": "Falling", "label": "ev_fall" },
          { "from": "Falling", "to": "Idle", "label": "ev_land" },
          { "from": "Attacking", "to": "Idle", "label": "ev_attack_end" },
          { "from": "Idle", "to": "Dead", "label": "ev_die" },
          { "from": "Running", "to": "Dead", "label": "ev_die" },
          { "from": "Jumping", "to": "Dead", "label": "ev_die" },
          { "from": "Falling", "to": "Dead", "label": "ev_die" },
          { "from": "Attacking", "to": "Dead", "label": "ev_die" }
        ]
      }
    ],
    "properties": [
      {
        "id": "no_softlock",
        "description": "No state is a dead end — every state has at least one outgoing transition",
        "template_ref": { "template": "no_deadlock" },
        "over": "PlayerState",
        "holds_in_fixed": true,
        "holds_in_vulnerable": false
      },
      {
        "id": "can_return_idle",
        "description": "From every state, Idle is always eventually reachable",
        "template_ref": { "template": "always_eventually", "args": { "TARGET": "Idle" } },
        "over": "PlayerState"
      },
      {
        "id": "dead_reachable",
        "description": "The Dead state is reachable from initial",
        "template_ref": { "template": "reachable", "args": { "TARGET": "Dead" } },
        "over": "PlayerState"
      }
    ]
  }
}
